{
    "id": "application-policy-3",
    "algorithm":"one-after-another",
    "networkPartitions":[
        "network-partition-1",
        "network-partition-2",
        "network-partition-3",
        "network-partition-4",
        "network-partition-5"
    ],
    "properties":[
        {
            "name": "network-partition-groups",
            "value": "network-partition-1|network-partition-2, network-partition-3, network-partition-4|network-partition-5"
        }
    ]
}
